{"schema_version":"1","inventory_run_id":"inventory-run-001","product_version":"0.1.0","agdf_run_id":"agdf-run-001","authority_context_ref":".agdf/control/artefacts/demo/PROJECT_INVENTORY_SCOPE.json","authority_context_digest":"sha256:ffffffffffffffffffffffffffffffffffffffffffffffffffffffffffffffff","status":"intake","created_at":"2026-08-21T12:00:00.000Z","artifacts":{"assessment_intake":"ASSESSMENT_INTAKE.json","evidence_register":"EVIDENCE_REGISTER.json","findings_register":"FINDINGS_AND_GAPS.json","inventory_report":"INVENTORY_REPORT.md","report_index":"INVENTORY_REPORT.index.json"}}
